{
  "protocol_version": "1.0",
  "decision_id": "decision-2026-1843-final",
  "evaluation_id": "eval-2026-1843-final",
  "request_id": "req-final-002",
  "evaluated_at": "2026-08-27T23:32:00Z",
  "outcome": "deny",
  "policy": {
    "bundle_id": "waystation-1-trust",
    "bundle_version": 42,
    "policy_id": "commercial-docking-v3",
    "policy_hash": "sha-384:cG9saWN5LWRpZ2VzdA"
  },
  "reason_codes": ["DENY_CREDENTIAL_EXPIRED"],
  "evidence": [
    {
      "type": "credential",
      "id": "urn:uuid:docking-cert-expired",
      "digest": "sha-384:ZXhwaXJlZC1jcmVkZW50aWFs",
      "result": "fail",
      "reason": "Docking certification expired before evaluation time"
    }
  ],
  "obligations": ["AUDIT_DECISION", "RETURN_TO_HOLD_ON_EXPIRY"]
}