{
  "protocol_version": "1.0",
  "decision_id": "decision-2026-1842-final",
  "evaluation_id": "eval-2026-1842-final",
  "request_id": "req-final-001",
  "evaluated_at": "2026-08-27T23:30:00Z",
  "outcome": "allow",
  "policy": {
    "bundle_id": "waystation-1-trust",
    "bundle_version": 42,
    "policy_id": "commercial-docking-v3",
    "policy_hash": "sha-384:cG9saWN5LWRpZ2VzdA"
  },
  "reason_codes": ["ALLOW_POLICY_SATISFIED"],
  "evidence": [
    {
      "type": "credential",
      "id": "urn:uuid:docking-cert-734",
      "digest": "sha-384:Y3JlZGVudGlhbC1kaWdlc3Q",
      "result": "pass"
    },
    {
      "type": "holder_proof",
      "id": "proof-001",
      "digest": "sha-384:aG9sZGVyLXByb29mLWRpZ2VzdA",
      "result": "pass"
    },
    {
      "type": "readiness",
      "id": "readiness-final-001",
      "digest": "sha-384:cmVhZGluZXNzLWRpZ2VzdA",
      "result": "pass"
    }
  ],
  "obligations": [
    "AUDIT_DECISION",
    "CONSUME_ENTITLEMENT_ON_USE",
    "RECHECK_OPERATIONAL_READINESS",
    "ABORT_ON_CONSTRAINT_VIOLATION"
  ],
  "entitlement": {
    "entitlement_id": "entitlement-final-001",
    "issuer": "station:waystation-1",
    "subject": "did:peer:2.EzOdysseyEncounter",
    "audience": "controller:odyssey-7:gnc-primary",
    "station_id": "station:waystation-1",
    "port_id": "port-3",
    "mission_id": "mission:ll-2026-1842",
    "session_id": "session:dock-2026-1842",
    "action": "enter_final_approach",
    "authorized_stage": "final_approach",
    "not_before": "2026-08-27T23:30:00Z",
    "expires_at": "2026-08-27T23:30:30Z",
    "sequence_number": 3,
    "request_nonce": "cmVxdWVzdC1ub25jZS0wMDE",
    "policy_hash": "sha-384:cG9saWN5LWRpZ2VzdA",
    "single_use": true,
    "constraints": {
      "max_closing_rate_mps": 0.2,
      "max_range_m": 1.12
    }
  }
}